title,issue,issue_href,url,content_type,publish_date,abstract
Proteins: Templates and Matrices in Molecular Imprinting,"August 2023, issue 8",/journal/10809/volumes-and-issues/78-8,https://link.springer.com/article/10.1134/S1061934823070110,REVIEWS,02 August 2023,This review considers the issues of molecular imprinting with the participation of proteins. Works in the field of bioimprinting published over the past five years and devoted to the determination of biomolecules and the enhancement of enzymatic activity are analyzed. Attention is focused on the imprinting of proteins as a method of modifying the molecular structure of proteins due to the formation of binding sites in the presence of substrates (proteins with molecular imprints or imprinted proteins). It is shown that the imprinting of proteins is promising for solving analytical problems. The ambiguous interpretation of the term bioimprinting in solving various problems is discussed.
Determination and Quantification of Cetirizine Dihydrochloride in Pharmaceutical Formulations and Biological Fluids Through Fluorescence Quenching of Eosin Y: Application to Content Uniformity Test,"August 2023, issue 8",/journal/10809/volumes-and-issues/78-8,https://link.springer.com/article/10.1134/S1061934823080129,ARTICLES,02 August 2023,"A simple, fast, sensitive, cost-effective, and well-proven spectrofluorimetric method has been developed for the quantification of cetirizine dihydrochloride (CTZ). The quenching effect of CTZ on the fluorescence intensity of Eosin Y was utilized to generate an ion-pair complex that can be detected at 549 nm using a 301 nm excitation wavelength in the presence of glycine buffer (pH 4.0) for the method development. The factors that influence reactions were thoroughly examined and optimized. With a determination coefficient of 0.9996, the fluorescence quenching value was linear to CTZ concentration in the range of 1–40 µg/mL. The estimated detection and quantification limits were determined to be 0.02 and 0.08 µg/mL, respectively. The method selectivity was validated by analyzing the effects of excipients, and no interference was found. The established approach was applied to determine the presence of CTZ in products available on the market as well as in biological samples. The methodology was validated using guidelines from the International Conference on Harmonization, and percent recoveries for pharmaceutical items varied from 90.6 to 103.5% and for biological fluids from 97.9 to 102.5%. The method has been successfully used for the content uniformity test with high percent recovery and low relative standard deviation."
Experience of the Determination of Fluorine in Rocks by X-Ray Fluorescence Spectrometry,"August 2023, issue 8",/journal/10809/volumes-and-issues/78-8,https://link.springer.com/article/10.1134/S1061934823080117,ARTICLES,02 August 2023,"The main fluorine-concentrating minerals in rocks are mainly apatites, amphiboles, micas, fluorites, sphenes, villiomites, in which fluorine is found in compounds with Ca, Mg, Na. The yield of the X‑ray fluorescence of fluorine depends on the element with which it is chemically bound. Taking into account this factor, three versions of calibration dependences for fluorine in the composition of CaF2, MgF2, and NaF were obtained using pressed tablets. Mixtures of these fluorides with granite, basalt, and limestone were used for calibration. To select an adequate calibration for the determination of fluorine in a batch of unknown samples, it was proposed to use the results of a selective analysis of fused samples of the batch."
A Green-Solvent Based Dispersive Liquid–Liquid Microextraction for Preconcentration and Cadmium Determination in Water and Food Samples by Flame Atomic Absorption Spectrometry,"August 2023, issue 8",/journal/10809/volumes-and-issues/78-8,https://link.springer.com/article/10.1134/S1061934823080075,ARTICLES,02 August 2023,"This research presents the use of deep eutectic solvents as a green and cost-effective extraction solvent in dispersive liquid–liquid microextraction of cadmium in food and environmental water specimen, where sodium diethyldithiocarbamate was employed as a complexing agent. A flame atomic absorption spectrometer was then used to quantify cadmium. The impacts of some effective variables such as deep eutectic solvent type and volume, pH, disperser solvent type and volume, diethyldithiocarbamate concentration, and extraction time were examined and optimized. Under optimal conditions, limit of detection was measured as 0.9 μg/L, while limit of quantification, enrichment factor, and relative standard deviation were 2.9 μg/L, 50, and 1.4%, respectively. The developed extraction method was successfully employed for Cd quantification in food and water. Recoveries of spiked samples varied in the range of 96.0–102.5%."
Adaptive Calibration in Electrothermal Atomic Absorption Spectrometry,"August 2023, issue 8",/journal/10809/volumes-and-issues/78-8,https://link.springer.com/article/10.1134/S1061934823080142,ARTICLES,02 August 2023,"A method is developed for determining concentrations in Zeeman electrothermal atomic absorption spectrometry based on the conversion of the transformation function of an atomic absorption spectrometer into a calibration dependence adapted to the matrix of the analyzed sample. The transformation function is expressed as a one-parameter saturation function, which is an integral optical characteristic of the spectrometer, independent of the composition of the analyzed sample. The algorithm of the method includes measurement of the analytical signals of an analyzed sample and a same sample with a known additive of the analyte and calculation of the matrix coefficient and the desired concentration of the analyte in the analyzed sample from these signals. The adaptive calibration method is tested for As, Au, Cd, Cu, Mo, Pd, Pb, Mo, Pd, Pb, Ti, V. The relative systematic error in determining the concentration of an element in the range of measuring the absorbance of atomic vapor does not exceed 10%. The analytical ranges for the elements exceed three orders of magnitude."
Effect of Organic Additives on the Intensity of Metal Lines in the Emission Spectrum of a Drop-Spark Discharge upon Sample Introduction into an Electrolyte Anode,"August 2023, issue 8",/journal/10809/volumes-and-issues/78-8,https://link.springer.com/article/10.1134/S1061934823080166,ARTICLES,02 August 2023,"The effect of the nature and concentration of organic medium modifiers on the intensity of lines of some heavy metals (Ag, Cd, Hg, Pb, Tl, Zn) in the spectrum of a drop-spark discharge upon sample introduction into an electrolyte anode is studied. It is shown that additives of 0.1–6 wt % of polar organic compounds greatly increase the intensity of Pb, Tl, and Zn lines and reduce the intensity of Ag lines. The greatest effect, a twenty-fold enhancement of zinc lines, is observed upon the introduction of methanol into dilute acids. The cadmium signal is insensitive to organic impurities in dilute acids, but is enhanced in concentrated salt solutions."
Characterization and Comparison of Automobile Paint Flakes as the Forensic Evidence,"August 2023, issue 8",/journal/10809/volumes-and-issues/78-8,https://link.springer.com/article/10.1134/S1061934823080051,ARTICLES,02 August 2023,"Automotive paint flakes are significant for the forensic scientists to use as the evidence for forensic purposes. Conducting the multichannel and scientific characterization and comparison of them is in urgent need to draw objective and fair conclusions, demonstrating the fair and equitable administration of justice. With the help of infrared spectroscopy (IR), Raman spectroscopy (Raman), scanning electron microscopy (SEM), energy disperse spectroscopy (EDS) and stereomicroscopy, the properties of three paint flakes from automobiles at the scene of the accident have been studied for forensic purposes in this paper. Primary discussion is progressed according to the stereomicroscope and SEM images, while the in-depth conclusion is proved by the component analysis acquired with EDS, IR and Raman. Furthermore, colors, thickness, sequence, microstructure and composition of layers provide much significant information. The third layers of all the samples show the significant changes clearly, indicating that sample C is different from samples A and B. However, the first, second and fourth layers give rise to consistent analysis profiles. The results of this study provide the significant fundamental information which can be used to analyze the paint flakes for forensic scientists."
Using Highly Sensitive Piezo Sensors in an Open System for the Diagnostic Analysis of Skin Volatile Substances,"August 2023, issue 8",/journal/10809/volumes-and-issues/78-8,https://link.springer.com/article/10.1134/S1061934823080105,ARTICLES,02 August 2023,"A single sensor with a piezoelectric quartz transducer is considered a platform for simulating an “electronic nose” that performs the function of a sensor array. The analytical task was to detect volatile organic compounds, component-by-component, in biosamples at diagnostically relevant concentrations without selecting mixtures or any sample preparation. We confirmed the fundamental possibility of utilizing a single sensor for the separate detection (recognition) of vapors of organic compounds and various functional states of a body during a short contact (60–80 s) with skin, the most representative and constantly performing bioassay. Modifying the electrodes of bulk acoustic wave piezoelectric quartz resonators with 2–4 μg of the nanohydroxyapatite phase is an essential step in solving the problem. The newly calculated adsorption kinetic parameters can be used to detect biomarkers of many diseases with high reliability, including С3–С5 alcohols, ketones, linear and cyclic amines, acids, aldehydes, etc. The hydroxyapatite sensor can detect molecules pointing to problems with many organs, and any abnormalities in the functioning of the nervous and cardiovascular systems. It can also measure the body’s responses and compensatory mechanisms in relation to stress, hunger, and fatigue. The sensor has a potential as a simple diagnostic and monitoring tool for point-of-care diagnostics of both adults and children."
Development of a Bioanalytical Method for the Determination of Aureofungin and Its Sodium Salt Derivative Using HPLC: an Application to Pharmacokinetic Studies,"August 2023, issue 8",/journal/10809/volumes-and-issues/78-8,https://link.springer.com/article/10.1134/S1061934823080154,ARTICLES,02 August 2023,"Since fungal infections are on the rise and with limited treatment options, there is a need to modify existing drugs either by making structural changes or making use of better drug delivery systems. Aureofungin, an antibiotic of a polyene class, is primarily used to prevent fungal infection in agriculture. However, it has limited application in clinical therapy due to high toxicity. Therefore, a water-soluble sodium salt derivative of aureofungin was synthesized as a promising antifungal agent, which required a bioanalytical method to be established for the quantitation in the biological matrix and thereby understanding its pharmacokinetics. As a result, in the present work, a simple and rapid reversed-phase high-performance liquid chromatography method was developed for the determination of aureofungin bulk and its water-soluble derivative in rat plasma. The analytes were separated in an isocratic mode using a C18 amide column (250 × 4.6 mm, 5 µm) and a mobile phase of 10 mM ammonium acetate (pH 4.0) and acetonitrile (55 : 45, v/v) with a flow rate of 1.0 mL/min at ambient temperature and detection at 378 nm. The analyte was efficiently extracted using a simple protein precipitation technique. The methodology was found to be linear (r2 ≥ 0.995), selective, repeatable (CV ≤ 15.0%), accurate (100 ± 15%), and free of any carryover effects. Under the investigated storage conditions, the bioanalytical samples demonstrated acceptable stability. An oral pharmacokinetic study in rats was then performed to verify the applicability of the method."
Profiling Detection and Validation of Six Sartan Substances in Human Urine by LC-MS/MS,"August 2023, issue 8",/journal/10809/volumes-and-issues/78-8,https://link.springer.com/article/10.1134/S1061934823080063,ARTICLES,02 August 2023,"Six sartan substances including telmisartan, losartan, valsartan, irbesartan, olmesartan, and candesartan were selected in this work. A simple and sensitive liquid chromatography–tandem mass spectrometry method was developed and validated to simutaniously detect six drugs. Linearity, LOD, and LOQ were satisfied for routine quantitative and qualitative detection. The linearity ranged from 2 to 1000 ng/mL with the determination coefficient more than 0.98. The intra-day and inter-day precisions were all below 27.5%. All the recoveries were above 80%, and matrix effects were between 25 and 120%. Profiling detection of six sartan substances in human urine was also developed after administration. Irbesartan urinary metabolic pathway was firstly investigated by liquid chromatography quadruple time-of-flight mass spectrometry using full scan and targeted tandem mass spectrometry techniques. Fifteen urinary metabolites of irbesartan were identified and characterized, and ten of them were firstly reported."
Approbation of a Procedure for Determining the Isotopic Composition of Individual Carbon Fractions in an Atmospheric Aerosol by Isotope Ratio Mass Spectrometry,"August 2023, issue 8",/journal/10809/volumes-and-issues/78-8,https://link.springer.com/article/10.1134/S1061934823070079,ARTICLES,02 August 2023,"The ratio of stable carbon isotopes can give important data about the sources of atmospheric carbon compounds. We consider a procedure for the determination of the isotopic composition of individual carbon fractions in atmospheric aerosols by isotope ratio mass spectrometry. We performed a preliminary analysis of carbon isotope composition (δ13C) for various carbonaceous aerosol fractions (total carbon, organic + elemental carbon without carbonates, water-soluble organic carbon, water-insoluble carbon, and elemental carbon) collected during marine Arctic expeditions at the Ice base “Cape Baranov”, at the geophysical observatory of the Institute of Monitoring of Climatic and Ecological Systems of the Siberian Branch of the Russian Academy of Sciences (IMCES SB RAS) (Tomsk), and at the OPTIK Tu-134 aircraft laboratory."
Development and Optimization of an Algorithm for Accurate Estimation of Real-Time Hydrogen Concentration Using a ZnO-Based Gas Sensor,"August 2023, issue 8",/journal/10809/volumes-and-issues/78-8,https://link.springer.com/article/10.1134/S1061934823080087,ARTICLES,02 August 2023,"This paper addresses the problem of estimation of hydrogen gas concentration using current output from a sensor chip, integrated with a thin film of ZnO as a sensing layer and inbuilt microheater to obtain desired operating temperature by proposing an appropriate algorithm. The proposed algorithm minimizes the estimation delay while maximizing the estimation accuracy. The proposed algorithm also accounts for the variation in sensor performance with relative humidity. The key features of the proposed algorithm are low computational complexity, low memory requirements, compatibility with any metal-oxides-based hydrogen sensors with independent calibration or turning points, and minimal requirements to the calibration time. As proof of concept, a demonstration of the algorithm efficiency is evaluated by estimating hydrogen concentration using ZnO thin film-based gas sensor device and comparing its performance with available state-of-the-art hydrogen sensor algorithm outputs."
Facile Synthesis of a Novel Zr/Fe3O4/GO Nanocomposite and Its Application for Modification of Electrode Surfaces and Voltammetric Determination of Nitrite Ions,"August 2023, issue 8",/journal/10809/volumes-and-issues/78-8,https://link.springer.com/article/10.1134/S1061934823080038,ARTICLES,02 August 2023,"A ZrNPs/Fe3O4/GO nanocomposite was successfully synthesized for the first time with an in-situ method, and its properties were defined by energy-dispersive X-ray spectroscopy, scanning electron microscopy, and powder-XRD techniques. Synthesized nanocomposite was then used as a modifier to prepare modified glassy carbon electrodes for the determination of nitrite ions in foodstuffs. Differential pulse voltammetry and cyclic voltammetry studies showed a high catalytic activity of the proposed nanocomposite in nitrite oxidation. In addition, the electrode showed a linear response between 3 and 76 μM, a detection limit of 3 μM, and high selectivity. The synthesized nanocomposite was stable for at least 9 months, and the resultant electrode had similar stability."
Biohybrid Technology for the Detection of Ultralow Concentrations of Trinitrotoluene in Air,"August 2023, issue 8",/journal/10809/volumes-and-issues/78-8,https://link.springer.com/article/10.1134/S1061934823080099,ARTICLES,02 August 2023,"The technology is based on recording the focal activity (FA) of the olfactory bulb (OB) of rats upon the exposure rats to trinitrotoluene (TNT) vapors in the concentration 4.7 × 10–15 g/cm3, separately and in a mixture with saturated vapors of a complex interference composed of spices. The focal activity of the rat olfactory bulb was recorded using an array of 16 special electrodes implanted in the dorsal part of the rat olfactory bulb. The setup contained a box with a rat, sources of vapors (odorants), a multichannel digital system for recording electrical signals from an electrode array, and software performing algorithms for recognizing and classifying odorants presented to the rat. One source of TNT vapors was a device for batch volumetric preparation with a concentration of about 10–15 g/cm3, and another source was a source with a concentration of 4.7 × 10–15 g/cm3 in an air flow presented to rats. Data from 25 tests showed a 100% probability of detecting TNT vapors of the specified concentrations in pure air and also in the presence of a complex odor interference in the form of vapors from a mixture of red pepper, coriander, tobacco, etc., which, as a rule, mask the smell of TNT for animals."
Estimation of Organic Opacifier in Water-Based Architectural Coatings Using Dynamic Mechanical Thermal Analysis,"August 2023, issue 8",/journal/10809/volumes-and-issues/78-8,https://link.springer.com/article/10.1134/S106193482308004X,ARTICLES,02 August 2023,"Hollow sphere polymeric pigments prepared from styrene-acrylate copolymer referred to as organic opacifiers (OP) are the primary substitutes of TiO2 in water-based architectural paints. This study describes the method for the quantification of OP in water-based paints using dynamic mechanical thermal analysis (DMTA). The significance of DMTA in visualizing the glass transitions over differential scanning calorimetry (DSC) is showcased. The glass transition temperature (Tg) of OP was found to be ~109°C by DSC method and ~125°C by DMTA method. The peak intensity of tan δ at Tg of OP in paints (tan δ2) is not affected by the curing time and linearly increases as a function of OP concentration in water-based paints, irrespective of the difference in volume solids. DMTA can efficiently quantify OP in paint film if it is ≥3.3% (w/w). Increasing concentration of a coalescing solvent in water-based paints has a detrimental effect on the peak intensity of tan δ2. Two commercially available grades of OP having difference in the core-shell morphology have been studied. Internal morphology of the OP studied by scanning electron microscopy has a significant effect on the peak intensity of tan δ2 thereby affecting its opacity performance in paints. Owing to the limited effect of curing time, volume solids and coalescing solvent on the peak intensity of tan δ2 of paints, this method can be used for the quantification of OP in paints, as it has been validated with seven commercially available paints with known OP contents."
Systematic Errors in the Results of Quantitative Chemical Analysis: from Incorrect Terms to Erroneous Concepts,"August 2023, issue 8",/journal/10809/volumes-and-issues/78-8,https://link.springer.com/article/10.1134/S1061934823060102,DISCUSSIONS,02 August 2023,"It is noticed that the conventional interpretation of systematic errors (or, what is the same, the list of varieties of systematic errors) generally reflects the actual situation, which does not exclude some refilling and specification with the appearance of new types of measurements and the sophistication of the existing ones. These additions should not mean the abolition of the general metrological, time-tested classification. In recent decades, trends have appeared aimed at replacing the meanings of terms and definitions with those uncharacteristic of them, or at introducing terms that have no real meaning at all into metrological practice. This, in turn, led to the emergence of erroneous concepts ensuring the accuracy of the results of quantitative chemical analysis and to the creation of far from perfect regulatory documents, which, among other reasons, was due to an uncritical attitude to international standards. Such concepts bring inaccuracies and erroneous recommendations into monographs and textbooks containing sections related to the metrological aspects of chemical analysis."
Origins and Formation of Ion Chromatography,"August 2023, issue 8",/journal/10809/volumes-and-issues/78-8,https://link.springer.com/article/10.1134/S1061934823080130,HISTORY OF ANALYTICAL CHEMISTRY,02 August 2023,"The origins and ways of formation of ion chromatography are shown. Little-known facts and publications are reflected, and a significant influence of the development of instrument making in HPLC and technologies for the synthesis of low-capacity sorbents on the development of this method is demonstrated. The early history of developments in the field of ion chromatography in the US scientific groups of H. Small (Dow Chemical and Dionex Corp.) and J. Fritz (Iowa State University) is described, and the scientific works and key achievements of these scientists are analyzed."
Capillary Electrophoresis in Assessing the Quality and Safety of Foods,"July 2023, issue 7",/journal/10809/volumes-and-issues/78-7,https://link.springer.com/article/10.1134/S106193482307002X,REVIEWS,18 July 2023,This review is dedicated to the application of capillary electrophoresis to assess the quality and safety of food products.
Spectrophotometric Investigation and Computational Studies of Zirconium(IV)-3-hydroxy-2-[1'-phenyl-3'-(p-methoxyphenyl)-4'-pyrazolyl]-4H-chromen-4-one Complex,"July 2023, issue 7",/journal/10809/volumes-and-issues/78-7,https://link.springer.com/article/10.1134/S1061934823070055,ARTICLES,18 July 2023,"A new binary liquid-liquid extraction technique incorporating 3-hydroxy-2-[1'-phenyl-3'-(p-methoxyphenyl)-4'-pyrazolyl]-4H-chromen-4-one (HPMPC) has been developed for the trace spectrophotometric detection and determination of Zr(IV). The optimal conditions for the formation of Zr(IV)−HPMPC complex in a ratio of 1 : 3 (M : L) were investigated. The resulting complex has yellow color and allows for the micro level measurement of zirconium in a straightforward and cost-effective manner. The process is quick, sensitive (1.073 × 105 L/mol cm) and selective. A good linearity (r = 0.9998) was observed for Zr(IV) in the range of 0.20–0.8 µg/mL. The approach is extremely repeatable with acceptable precision and accuracy (RSD of 0.3%) and can be expanded to include the examination of zirconium in a variety of samples (synthetic, natural and technical). The analytical investigation was successfully extended to DFT calculations to forecast the structural geometry and confirm the complex ultimate stoichiometry. The calculations not only produced an optimal complex structure, but also confirmed the bidentate ligand chelating efficacy by coordinating benzopyran ring to the metal center."
New Schiff Base-Linked Arylazopyrazoles as Reagents for the Photometric Detection of Fluoride Ions,"July 2023, issue 7",/journal/10809/volumes-and-issues/78-7,https://link.springer.com/article/10.1134/S1061934823070109,ARTICLES,18 July 2023,"A novel class of reagents (L1–3) containing arylazopyrazole moiety linked to a Schiff base have been synthesized and investigated for anion sensing applications. All three compounds exhibited excellent sensitivity and selectivity toward selective colorimetric detection of F– in dimethyl sulfoxide. F– sensing mechanisms have been explored by various spectroscopic techniques, viz., 1H NMR, IR, UV-visible, and fluorescence spectroscopy. A clear qualitative and quantitative detection of F– was possible with specificity and good sensitivity with L2 giving optimum results. The LOD value of L2 toward F– was found to be 7 µM. These reagents were applied for fluoride detection in commercial toothpaste as well."
