title,issue,issue_href,url,content_type,publish_date,abstract
Validated Spectrophotometric Methods for the Resolution of the Binary Mixture of Silver Sulfadiazine and Sodium Hyaluronate in the Presence of Paraben in Their Dosage Form,"July 2023, issue 7",/journal/10809/volumes-and-issues/78-7,https://link.springer.com/article/10.1134/S1061934823070031,ARTICLES,18 July 2023,"Two simple, rapid, accurate, and precise spectrophotometric methods were developed for the determination of silver sulfadiazine (SSD) and sodium hyaluronate (SH) in the presence of methyl and propyl paraben. The methods were applied after the division of each zero-order spectrum of SSD and SH by the spectrum of paraben to exclude it. Method A, a dual wavelength of ratio spectra method, is based on selection of two wavelengths at which the peak amplitude of SH is the same but different for SSD, so wavelengths of 258.0 and 312.6 nm were used to determine SSD in the presence of SH. Other two wavelengths were selected at 208.0 and 238.4 nm for the determination of SH in the presence of SSD. Method B was first derivative spectrophotometry for the determination of SSD and fourth derivative spectrophotometry for the determination of SH. Peak amplitudes were measured at 236.0 and 225.2 nm for SSD and SH, respectively. The proposed methods were validated according to ICH recommendations. The calibration curves for the proposed methods were linear over a concentration range of 1.0–10 and 25–250 µg/mL for SSD and SH, respectively. The specificity of the proposed methods was tested using different laboratory prepared mixtures of both drugs showing high specificity of SSD and SH with accepted recovery values. The proposed methods have been successfully applied for the determination of SSD and SH in pharmaceutical dosage forms without interference from additives."
A Spectrophotometric Method for Tetracycline Determination in its Bulk Powder and Pharmaceutical Formulations Using Flow Injection and Batch Procedures: a Comparative Study,"July 2023, issue 7",/journal/10809/volumes-and-issues/78-7,https://link.springer.com/article/10.1134/S1061934823070080,ARTICLES,18 July 2023,"A reliable and environmental analytical method was developed for the direct determination of tetracycline using flow injection analysis (FIA) and batch procedures with spectrophotometric detection. The developed method is based on the reaction between a chromogenic reagent (vanadium (III) solution) and tetracycline at room temperature and in a neutral medium, resulting in the formation of an intense brown product that shows maximum absorption at 395 nm. The analytical conditions were improved by the application of experimental design. The proposed method was successfully used to analyze samples of commercial medications and verified throughout the concentration ranges of 25–250 and 3–25 µg/mL for both FIA and batch procedures, respectively. The limits for quantification and detection were 37 and 11 µg/mL for the FIA procedure, respectively, while were 5 and 1.5 µg/mL for the batch procedure, respectively. The commercial samples were also subjected to an HPLC analysis, and the outcomes were in high agreement with the developed method using suggested procedures. The proposed FIA and batch procedures can be immediately employed in the pharmaceutical sector for quality control of tetracycline during the production processes."
Quantitative Determination of Related Substances in Propofol by Supercritical Fluid (CO2) Chromatography,"July 2023, issue 7",/journal/10809/volumes-and-issues/78-7,https://link.springer.com/article/10.1134/S1061934823070146,ARTICLES,18 July 2023,"An environmentally friendly, simple and rapid supercritical fluid chromatography (SFC) method was established and validated for the simultaneous determination of ten related substances in propofol bulk drug. The separation was achieved on a Zorbax-silica column at 40°C with a mobile phase consisting of supercritical carbon dioxide (CO2) and heptane containing 10% isopropanol (98 : 2, v/v) in 11 min. Satisfactory resolution and peak shapes for propofol and ten related substances were obtained after optimizing the chromatography system. The ten related substances could be accurately quantified in the 0.03–0.63 μg/mL concentration range with correlation coefficients (r2) ranging from 0.9991 to 0.9998 and recoveries ranging from 92.0 to 113.2%. Furthermore, five stress tests demonstrated that propofol bulk drug degradation occurred under the condition of heat, oxidative degradation, acid and base hydrolysis. Results of orthogonality to our prior GC–MS/MS method suggested this SFC method was time-saving and alternative for propofol quality control."
Dispersive Liquid–Liquid Microextraction of Preservatives for Their Chromatographic Determination in Beverages,"July 2023, issue 7",/journal/10809/volumes-and-issues/78-7,https://link.springer.com/article/10.1134/S1061934823070092,ARTICLES,18 July 2023,"A method of dispersive liquid–liquid microextraction, based on the dispersion of an extractant by the gas phase formed as a result of a phase transition, i.e., the evaporation of a highly volatile nonpolar organic solvent (dispersant) upon heating the extraction,—is developed. The analytical capabilities of the method are shown in the determination of preservatives (sorbic and benzoic acids) in soft drinks for baby food by high-performance liquid chromatography with photometric detection. The extractant and the dispersant for the microextraction of preservatives are chosen a terpenoid and a highly volatile organochlorine solvent, respectively, which excluded the use of polar organic solvents for dispersing phases, with which the distribution coefficients are reduced. The limits of detection (3σ) for sorbic and benzoic acids are 0.3 mg/L. The developed method does not require centrifugation for phase separation."
Development of an UPLC-QTOF-MS Method for the Simultaneous Estimation of Dronedarone and its Unlisted Pharmacopoeial Impurities,"July 2023, issue 7",/journal/10809/volumes-and-issues/78-7,https://link.springer.com/article/10.1134/S1061934823070122,ARTICLES,18 July 2023,"For the first time, an UPLC-QTOF-MS method was developed and validated to simultaneously estimate dronedarone (DDN) and its four unlisted pharmacopoeial impurities: DDN impurities A, B, C, and D. UPLC separation was performed for 6 min on a BEH C18 (50 × 2.1 mm, 1.7 µm) columnwith 0.1% formic acid in water (A) and acetonitrile (B) as mobile phase delivered in gradient at a constant flow rate of 0.6 mL/min. Mass spectrometric detection was performed in ESI-QTOF-MS. The LOD and LOQ values for the analytes ranged from 0.5 to 10 and 0.8 to 75 ng/mL, respectively. The method was found to be linear for all analyte ranges with r2 values ≥0.9998. The method was precise with %RSD values ≤6.5% and overall analyte recovery was found to be 99.8 ± 1.0%. A novel, sensitive, selective, specific, linear, and accurate UPLC-QTOF-MS method was developed and validated to simultaneously estimate DDN and its impurities which are not listed in the pharmacopoeia."
Novel Adsorbents for the Determination of Amino Acids in Soil Extracts by Hydrophilic Interaction Liquid Chromatography with Mass Spectrometric Detection,"July 2023, issue 7",/journal/10809/volumes-and-issues/78-7,https://link.springer.com/article/10.1134/S1061934823070043,ARTICLES,18 July 2023,"Adsorbents based on various substrates—silica and a copolymer of styrene with divinylbenzene—are developed for the determination of amino acids by hydrophilic interaction liquid chromatography—mass spectrometry. The optimal version of the structure of the functional layer in two series of the obtained stationary phases was chosen, which provides the best hydrophilization for each substrate. Retention mechanisms were studied and the conditions for the mass-spectrometric detection, separation, and determination of 16 amino acids were chosen. The applicability of the obtained adsorbents and a method for determining amino acids for the analysis of soil extracts were estimated."
A Voltammetric Sensor Based on Aluminophosphate Zeolite and a Composite of Betulinic Acid with a Chitosan Polyelectrolyte Complex for the Identification and Determination of Naproxen Enantiomers,"July 2023, issue 7",/journal/10809/volumes-and-issues/78-7,https://link.springer.com/article/10.1134/S1061934823070158,ARTICLES,18 July 2023,"A voltammetric sensor was developed based on a glassy carbon electrode with aluminophosphate zeolite finely dispersed on its surface, modified with a polyelectrolyte complex of chitosan with succinyl chitosan and betulinic acid, for the selective detection and determination of naproxen enantiomers. The electrochemical and analytical characteristics of the sensor were studied, and the effective electrode surface area (A = 9.8 ± 0.5 mm2) and charge transfer resistance (Ret = 649.9 ± 0.4 Ω) were calculated. In determining naproxen enantiomers, calibration characteristics are linear in the range from 2.5 × 10–5 to 1 × 10–3 M with limits of detection of 1.1 × 10–7 and 1.5 × 10–7 M and limits of quantification of 3.6 × 10–7 and 4.9 × 10–7 M for R- and S-naproxen, respectively. The sensor is more sensitive to R-naproxen (∆Ep = 60 mV, ipR/ipS = 1.40). The proposed sensor was used to recognize and determine naproxen enantiomers in human urine and plasma samples. Statistical evaluation of the results by the standard addition method showed that there was no systematic error."
Cathode Nanophosphors,"July 2023, issue 7",/journal/10809/volumes-and-issues/78-7,https://link.springer.com/article/10.1134/S1061934823070134,ARTICLES,18 July 2023,"High-current cathodic pulses on an aluminum electrode in solutions containing sufficiently high concentrations of Mg, Ca, Sr, Al, Sc, Y, or La nitrates in a mixture with H3BO3, HF, H3PO4, or H4P2O7 are accompanied by an intense intrinsic luminescence of a number of heavy metals, the ions of which are captured by salt nanofilms and luminescence under the action of hot electrons when are in an environment characteristic of crystal phosphors. The effect of the cathode nanophosphor (CNP) was found in more than 100 systems; photographs are presented for most of the systems. Ga, In, Tl, Ge, Sn, Pb, Mn, Cu, Ag, Cd, Ce, Tb, and Zr ions were activators. The effect of matrix composition on the spectral and kinetic characteristics of the CNP was shown on several examples; a qualitative description of the phenomenon is given, and the prospects for its application to chemical analysis are considered."
